{
  "schema_version": 1,
  "generated_at": "2026-09-22",
  "source": {
    "publisher": "Province of British Columbia — Residential Tenancy Branch",
    "index_url": "https://www2.gov.bc.ca/gov/content/housing-tenancy/residential-tenancies/calculators-and-resources/tenancy-forms",
    "snapshot_sha256": "35ad874008ca6ad82f3b114524ed6ab1da742f3fcd4a056301ec630d6945c6dd"
  },
  "forms": [
    {
      "id": "RTB-1",
      "form_name": "Residential Tenancy Agreement",
      "status": "active",
      "category": "general",
      "matter_type": "agreement",
      "current_version": "July 2026",
      "official_url": "https://www2.gov.bc.ca/assets/gov/housing-and-tenancy/residential-tenancies/forms/rtb1.pdf",
      "official_index_url": "https://www2.gov.bc.ca/gov/content/housing-tenancy/residential-tenancies/calculators-and-resources/tenancy-forms",
      "initiating_party": "landlord",
      "parties": [
        "landlord",
        "tenant"
      ],
      "property_manager_role": "may_prepare_and_sign_as_authorized_agent",
      "use_when": "Starting a residential tenancy or documenting the main written tenancy agreement.",
      "related_forms": [
        "RTB-22",
        "RTB-27",
        "RTB-26"
      ],
      "last_verified": "2026-09-22"
    },
    {
      "id": "RTB-2",
      "form_name": "Application for Review Consideration",
      "status": "active",
      "category": "post_decision",
      "matter_type": "review_consideration",
      "current_version": "March 2025",
      "official_url": "https://www2.gov.bc.ca/assets/gov/housing-and-tenancy/residential-tenancies/forms/rtb2.pdf",
      "official_index_url": "https://www2.gov.bc.ca/gov/content/housing-tenancy/residential-tenancies/calculators-and-resources/tenancy-forms",
      "initiating_party": "either",
      "parties": [
        "landlord",
        "tenant"
      ],
      "property_manager_role": "may_prepare_and_sign_as_authorized_agent",
      "use_when": "A party asking the RTB to review a decision or order on the limited grounds the legislation allows.",
      "related_forms": [
        "RTB-6",
        "RTB-38"
      ],
      "last_verified": "2026-09-22"
    },
    {
      "id": "RTB-5",
      "form_name": "Manufactured Home Site Tenancy Agreement",
      "status": "active",
      "category": "manufactured_home_park",
      "matter_type": "agreement",
      "current_version": "December 2017",
      "official_url": "https://www2.gov.bc.ca/assets/gov/housing-and-tenancy/residential-tenancies/forms/rtb5.pdf",
      "official_index_url": "https://www2.gov.bc.ca/gov/content/housing-tenancy/residential-tenancies/calculators-and-resources/tenancy-forms",
      "initiating_party": "landlord",
      "parties": [
        "landlord",
        "tenant"
      ],
      "property_manager_role": "may_prepare_and_sign_as_authorized_agent",
      "use_when": "Starting a manufactured home site tenancy or documenting its written tenancy agreement.",
      "related_forms": [
        "RTB-26"
      ],
      "last_verified": "2026-09-22"
    },
    {
      "id": "RTB-6",
      "form_name": "Request for Correction",
      "status": "active",
      "category": "post_decision",
      "matter_type": "correction",
      "current_version": "July 2023",
      "official_url": "https://www2.gov.bc.ca/assets/gov/housing-and-tenancy/residential-tenancies/forms/rtb6.pdf",
      "official_index_url": "https://www2.gov.bc.ca/gov/content/housing-tenancy/residential-tenancies/calculators-and-resources/tenancy-forms",
      "initiating_party": "either",
      "parties": [
        "landlord",
        "tenant"
      ],
      "property_manager_role": "may_prepare_and_sign_as_authorized_agent",
      "use_when": "A party asking the RTB to correct a clerical, math or similar obvious error in a decision or order.",
      "related_forms": [
        "RTB-2",
        "RTB-38"
      ],
      "last_verified": "2026-09-22"
    },
    {
      "id": "RTB-7",
      "form_name": "Notice of Rent Increase - Residential Rental Units",
      "status": "active",
      "category": "rent_increase",
      "matter_type": "standard_rent_increase",
      "current_version": "August 2024",
      "official_url": "https://www2.gov.bc.ca/assets/gov/housing-and-tenancy/residential-tenancies/forms/rtb7.pdf",
      "official_index_url": "https://www2.gov.bc.ca/gov/content/housing-tenancy/residential-tenancies/calculators-and-resources/tenancy-forms",
      "initiating_party": "landlord",
      "parties": [
        "landlord",
        "tenant"
      ],
      "property_manager_role": "may_prepare_and_sign_as_authorized_agent",
      "use_when": "A landlord notifying a tenant of a residential rental unit of a rent increase.",
      "related_forms": [
        "RTB-52"
      ],
      "last_verified": "2026-09-22"
    },
    {
      "id": "RTB-8",
      "form_name": "Mutual Agreement to End a Tenancy",
      "status": "active",
      "category": "ending_tenancy",
      "matter_type": "mutual_agreement",
      "current_version": "July 2025",
      "official_url": "https://www2.gov.bc.ca/assets/gov/housing-and-tenancy/residential-tenancies/forms/rtb8.pdf",
      "official_index_url": "https://www2.gov.bc.ca/gov/content/housing-tenancy/residential-tenancies/calculators-and-resources/tenancy-forms",
      "initiating_party": "either",
      "parties": [
        "landlord",
        "tenant"
      ],
      "property_manager_role": "may_prepare_and_sign_as_authorized_agent",
      "use_when": "A landlord and tenant agreeing in writing to end a tenancy on a set date.",
      "related_forms": [
        "RTB-1"
      ],
      "last_verified": "2026-09-22"
    },
    {
      "id": "RTB-9",
      "form_name": "Proof of Service Notice of Expedited Hearing",
      "status": "active",
      "category": "dispute_resolution",
      "matter_type": "proof_of_service",
      "current_version": "February 2022",
      "official_url": "https://www2.gov.bc.ca/assets/gov/housing-and-tenancy/residential-tenancies/forms/rtb9.pdf",
      "official_index_url": "https://www2.gov.bc.ca/gov/content/housing-tenancy/residential-tenancies/calculators-and-resources/tenancy-forms",
      "initiating_party": "either",
      "parties": [
        "landlord",
        "tenant"
      ],
      "property_manager_role": "may_prepare_and_sign_as_authorized_agent",
      "use_when": "Proving service of the notice of an expedited hearing on the other party.",
      "related_forms": [
        "RTB-12L-EXH",
        "RTB-12T-EXH"
      ],
      "last_verified": "2026-09-22"
    },
    {
      "id": "RTB-11A",
      "form_name": "Notice of Rent Increase - Manufactured Home Site - (auto-calculating version)",
      "status": "active",
      "category": "manufactured_home_park",
      "matter_type": "rent_increase",
      "current_version": "August 2026",
      "official_url": "https://www2.gov.bc.ca/assets/gov/housing-and-tenancy/residential-tenancies/forms/rtb11a.pdf",
      "official_index_url": "https://www2.gov.bc.ca/gov/content/housing-tenancy/residential-tenancies/calculators-and-resources/tenancy-forms",
      "initiating_party": "landlord",
      "parties": [
        "landlord",
        "tenant"
      ],
      "property_manager_role": "may_prepare_and_sign_as_authorized_agent",
      "use_when": "A manufactured home park landlord notifying a tenant of a site rent increase above the standard amount, with the amount auto-calculated.",
      "related_forms": [
        "RTB-45",
        "RTB-52"
      ],
      "last_verified": "2026-09-22"
    },
    {
      "id": "RTB-12L-CT",
      "form_name": "Landlord's Application for Dispute Resolution (Current Tenancy)",
      "status": "active",
      "category": "dispute_resolution",
      "matter_type": "application",
      "current_version": "June 2025",
      "official_url": "https://www2.gov.bc.ca/assets/gov/housing-and-tenancy/residential-tenancies/forms/rtb12lct.pdf",
      "official_index_url": "https://www2.gov.bc.ca/gov/content/housing-tenancy/residential-tenancies/calculators-and-resources/tenancy-forms",
      "initiating_party": "landlord",
      "parties": [
        "landlord",
        "tenant"
      ],
      "property_manager_role": "may_prepare_and_sign_as_authorized_agent",
      "use_when": "A landlord applying for dispute resolution while the tenant still lives in the unit.",
      "related_forms": [
        "RTB-26",
        "RTB-43",
        "RTB-55",
        "RTB-17",
        "RTB-37",
        "RTB-42L"
      ],
      "last_verified": "2026-09-22"
    },
    {
      "id": "RTB-12L-DR",
      "form_name": "Landlord Application for Dispute Resolution Direct Request",
      "status": "active",
      "category": "direct_request",
      "matter_type": "application",
      "current_version": "March 2022",
      "official_url": "https://www2.gov.bc.ca/assets/gov/housing-and-tenancy/residential-tenancies/forms/rtb12ldr.pdf",
      "official_index_url": "https://www2.gov.bc.ca/gov/content/housing-tenancy/residential-tenancies/calculators-and-resources/tenancy-forms",
      "initiating_party": "landlord",
      "parties": [
        "landlord",
        "tenant"
      ],
      "property_manager_role": "may_prepare_and_sign_as_authorized_agent",
      "use_when": "A landlord applying by direct request for possession and unpaid rent after serving a 10 Day Notice for unpaid rent or utilities.",
      "related_forms": [
        "RTB-30",
        "RTB-34",
        "RTB-46"
      ],
      "last_verified": "2026-09-22"
    },
    {
      "id": "RTB-12L-EXH",
      "form_name": "Landlord's Application for Dispute Resolution Expedited Hearing",
      "status": "active",
      "category": "dispute_resolution",
      "matter_type": "expedited_hearing",
      "current_version": "September 2023",
      "official_url": "https://www2.gov.bc.ca/assets/gov/housing-and-tenancy/residential-tenancies/forms/rtb12lexh.pdf",